{
 "name": "Orthogonal Transform",
 "id": "orthogonal_transform",
 "category": "math",
 "description": "Fixed random orthogonal rotation Q (QR-derived) applied to a state vector. Run 6d/7 showed no measurable learning effect (negative result).",
 "inputs": [
  {
   "name": "x",
   "type": "tensor"
  }
 ],
 "outputs": [
  {
   "name": "rotated",
   "type": "tensor"
  }
 ],
 "properties": [
  {
   "name": "dim",
   "type": "int",
   "default": 256,
   "description": "Dimension"
  }
 ],
 "code": "_ot{{_id}}_Q, _ = np.linalg.qr(np.random.randn({{dim}}, {{dim}}).astype(np.float32))\n{{rotated}} = {{x}} @ _ot{{_id}}_Q",
 "imports": [
  "import numpy as np"
 ],
 "color": "#95a5a6"
}