[
  {
    "name": "MatMul",
    "id": "matmul",
    "category": "math",
    "description": "Matrix multiplication of two tensors",
    "inputs": [
      { "name": "A", "type": "tensor" },
      { "name": "B", "type": "tensor" }
    ],
    "outputs": [
      { "name": "result", "type": "tensor" }
    ],
    "code": "{{result}} = np.matmul({{A}}, {{B}})",
    "imports": ["import numpy as np"],
    "color": "#4ecdc4"
  },
  {
    "name": "Add",
    "id": "add",
    "category": "math",
    "description": "Element-wise addition of two tensors",
    "inputs": [
      { "name": "A", "type": "tensor" },
      { "name": "B", "type": "tensor" }
    ],
    "outputs": [
      { "name": "result", "type": "tensor" }
    ],
    "code": "{{result}} = {{A}} + {{B}}",
    "imports": [],
    "color": "#4ecdc4"
  },
  {
    "name": "Subtract",
    "id": "subtract",
    "category": "math",
    "description": "Element-wise subtraction of two tensors",
    "inputs": [
      { "name": "A", "type": "tensor" },
      { "name": "B", "type": "tensor" }
    ],
    "outputs": [
      { "name": "result", "type": "tensor" }
    ],
    "code": "{{result}} = {{A}} - {{B}}",
    "imports": [],
    "color": "#4ecdc4"
  },
  {
    "name": "Multiply",
    "id": "multiply",
    "category": "math",
    "description": "Element-wise multiplication of two tensors",
    "inputs": [
      { "name": "A", "type": "tensor" },
      { "name": "B", "type": "tensor" }
    ],
    "outputs": [
      { "name": "result", "type": "tensor" }
    ],
    "code": "{{result}} = {{A}} * {{B}}",
    "imports": [],
    "color": "#4ecdc4"
  },
  {
    "name": "Divide",
    "id": "divide",
    "category": "math",
    "description": "Element-wise division of two tensors",
    "inputs": [
      { "name": "A", "type": "tensor" },
      { "name": "B", "type": "tensor" }
    ],
    "outputs": [
      { "name": "result", "type": "tensor" }
    ],
    "code": "{{result}} = {{A}} / {{B}}",
    "imports": [],
    "color": "#4ecdc4"
  },
  {
    "name": "Power",
    "id": "power",
    "category": "math",
    "description": "Raise tensor to a power",
    "inputs": [
      { "name": "base", "type": "tensor" },
      { "name": "exponent", "type": "scalar" }
    ],
    "outputs": [
      { "name": "result", "type": "tensor" }
    ],
    "code": "{{result}} = np.power({{base}}, {{exponent}})",
    "imports": ["import numpy as np"],
    "color": "#4ecdc4"
  },
  {
    "name": "Sqrt",
    "id": "sqrt",
    "category": "math",
    "description": "Element-wise square root",
    "inputs": [
      { "name": "input", "type": "tensor" }
    ],
    "outputs": [
      { "name": "result", "type": "tensor" }
    ],
    "code": "{{result}} = np.sqrt({{input}})",
    "imports": ["import numpy as np"],
    "color": "#4ecdc4"
  },
  {
    "name": "Exp",
    "id": "exp",
    "category": "math",
    "description": "Element-wise exponential (e^x)",
    "inputs": [
      { "name": "input", "type": "tensor" }
    ],
    "outputs": [
      { "name": "result", "type": "tensor" }
    ],
    "code": "{{result}} = np.exp({{input}})",
    "imports": ["import numpy as np"],
    "color": "#4ecdc4"
  },
  {
    "name": "Log",
    "id": "log",
    "category": "math",
    "description": "Element-wise natural logarithm",
    "inputs": [
      { "name": "input", "type": "tensor" }
    ],
    "outputs": [
      { "name": "result", "type": "tensor" }
    ],
    "code": "{{result}} = np.log({{input}})",
    "imports": ["import numpy as np"],
    "color": "#4ecdc4"
  },
  {
    "name": "Abs",
    "id": "abs",
    "category": "math",
    "description": "Element-wise absolute value",
    "inputs": [
      { "name": "input", "type": "tensor" }
    ],
    "outputs": [
      { "name": "result", "type": "tensor" }
    ],
    "code": "{{result}} = np.abs({{input}})",
    "imports": ["import numpy as np"],
    "color": "#4ecdc4"
  },
  {
    "name": "Negate",
    "id": "negate",
    "category": "math",
    "description": "Element-wise negation (-x)",
    "inputs": [
      { "name": "input", "type": "tensor" }
    ],
    "outputs": [
      { "name": "result", "type": "tensor" }
    ],
    "code": "{{result}} = -{{input}}",
    "imports": [],
    "color": "#4ecdc4"
  },
  {
    "name": "Reciprocal",
    "id": "reciprocal",
    "category": "math",
    "description": "Element-wise reciprocal (1/x)",
    "inputs": [
      { "name": "input", "type": "tensor" }
    ],
    "outputs": [
      { "name": "result", "type": "tensor" }
    ],
    "code": "{{result}} = 1.0 / {{input}}",
    "imports": [],
    "color": "#4ecdc4"
  },
  {
    "name": "Clamp",
    "id": "clamp",
    "category": "math",
    "description": "Clamp tensor values to a range",
    "inputs": [
      { "name": "input", "type": "tensor" }
    ],
    "outputs": [
      { "name": "result", "type": "tensor" }
    ],
    "properties": [
      { "name": "min_val", "type": "float", "default": 0.0, "description": "Minimum value" },
      { "name": "max_val", "type": "float", "default": 1.0, "description": "Maximum value" }
    ],
    "code": "{{result}} = np.clip({{input}}, {{min_val}}, {{max_val}})",
    "imports": ["import numpy as np"],
    "color": "#4ecdc4"
  },
  {
    "name": "PCError",
    "id": "pc_error",
    "category": "math",
    "description": "Prediction error: observation − prediction. Routes error as both signal and learning trigger.",
    "inputs": [
      { "name": "observation", "type": "tensor" },
      { "name": "prediction", "type": "tensor" }
    ],
    "outputs": [
      { "name": "error", "type": "tensor" }
    ],
    "properties": [],
    "code": "{{error}} = {{observation}} - {{prediction}}",
    "imports": [],
    "color": "#4ecdc4"
  },
  {
    "name": "ForwardNoise",
    "id": "forward_noising",
    "category": "math",
    "description": "Adds Gaussian noise: x + σ·ε where ε ~ N(0, I).",
    "inputs": [
      { "name": "x", "type": "tensor" }
    ],
    "outputs": [
      { "name": "noisy_x", "type": "tensor" }
    ],
    "properties": [
      { "name": "sigma", "type": "float", "default": 1.0, "description": "Noise scale σ" }
    ],
    "code": "{{noisy_x}} = {{x}} + {{sigma}} * np.random.randn(*{{x}}.shape).astype(np.float32)",
    "imports": ["import numpy as np"],
    "color": "#4ecdc4"
  },
  {
    "name": "CFGCombiner",
    "id": "cfg_combiner",
    "category": "math",
    "description": "Classifier-free guidance: w·cond_pred + (1-w)·uncond_pred.",
    "inputs": [
      { "name": "cond", "type": "tensor" },
      { "name": "uncond", "type": "tensor" }
    ],
    "outputs": [
      { "name": "out", "type": "tensor" }
    ],
    "properties": [
      { "name": "guidance_scale", "type": "float", "default": 3.0, "description": "CFG guidance weight w" }
    ],
    "code": "{{out}} = {{guidance_scale}} * {{cond}} + (1.0 - {{guidance_scale}}) * {{uncond}}",
    "imports": [],
    "color": "#4ecdc4"
  },
  {
    "name": "FreeEnergy",
    "id": "free_energy",
    "category": "math",
    "description": "Aggregates prediction errors across layers into a scalar via sum or mean.",
    "inputs": [
      { "name": "errors", "type": "tensor[]" }
    ],
    "outputs": [
      { "name": "energy", "type": "tensor" }
    ],
    "properties": [
      { "name": "reduction", "type": "enum", "default": "sum", "options": ["sum", "mean"], "description": "Reduction method" }
    ],
    "code": "_fe{{_id}}_terms = np.array([float(np.sum(e ** 2)) for e in {{errors}}])\n{{energy}} = np.sum(_fe{{_id}}_terms) if '{{reduction}}' == 'sum' else np.mean(_fe{{_id}}_terms)",
    "imports": ["import numpy as np"],
    "color": "#4ecdc4"
  }
]
